[{"activities":["徒步","摄影","观景台游览"],"adcode":"430811","bestSeasons":["spring","autumn"],"city":"张家界市","district":"武陵源区","highlights":["石英砂岩峰林地貌，峰柱密集且多座超过200米","金鞭溪峡谷溪流与天然氧吧步道","袁家界、天子山等观景台可俯瞰峰林云海"],"id":"zhangjiajie-national-forest-park","images":[],"location":{"coordSystem":"WGS-84","lat":29.3153,"lng":110.4341},"name":"张家界国家森林公园","province":"湖南省","seasonNotes":"春季多雾、秋季天高云淡能见度较好；具体天气以出行前预报为准。","source":{"name":"联合国教科文组织世界遗产中心·武陵源风景与历史名胜区","retrievedAt":"2026-10-22","url":"https://whc.unesco.org/en/list/640/"},"status":"draft","suggestedDays":{"max":3,"min":2},"summary":"位于武陵源风景名胜区核心地带，以三千余座石英砂岩峰柱著称，峰林、峡谷、溪流与常年云雾构成独特地貌，属世界自然遗产武陵源的组成部分。","themes":["nature","mountains","photography","hiking"],"transportNotes":"可乘高铁至张家界西站后转乘旅游专线车前往武陵源标志门一带；班次与票价以车站当日公告为准，本站不收录。","type":"mountain","verificationNote":"草案：坐标为景区东门附近近似值、图片未取得授权、交通表述待总设计师复核；完成逐项核验后才可改为 published。","verifiedAt":"2026-10-22"},{"activities":["环湖步行","摄影","园林游览"],"adcode":"330106","bestSeasons":["spring","autumn"],"city":"杭州市","district":"西湖区","highlights":["苏堤、白堤等湖堤景观与十景文化传统","湖中岛屿、亭台与环湖历史建筑群","对中国以及日本、韩国园林设计产生过深远影响"],"id":"west-lake-hangzhou","images":[],"location":{"coordSystem":"WGS-84","lat":30.2431,"lng":120.1502},"name":"杭州西湖","province":"浙江省","seasonNotes":"春季桃柳与秋季桂香为代表性时段；节假日环湖区域人流较大。","source":{"name":"联合国教科文组织世界遗产中心·杭州西湖文化景观","retrievedAt":"2026-10-22","url":"https://whc.unesco.org/en/list/1334/"},"status":"draft","suggestedDays":{"max":2,"min":1},"summary":"西湖文化景观由西湖与三面环绕的丘陵组成，自九世纪起启发众多诗人、学者与艺术家，湖堤、岛屿、亭台与园林构成人与自然融合的经典景观。","themes":["nature","historic","photography","family"],"transportNotes":"杭州市内多条地铁线路可达湖滨与西湖景区周边站点，出站后步行或接驳公交前往环湖区域；具体线路以杭州地铁当日运营信息为准。","type":"cultural","verificationNote":"草案：坐标为湖心区域近似值、图片未取得授权；完成逐项核验后才可改为 published。","verifiedAt":"2026-10-22"},{"activities":["古城步行游览","摄影","文化参观"],"adcode":"530702","bestSeasons":["spring","autumn"],"city":"丽江市","district":"古城区","highlights":["依山就水的大研古城街巷与水系格局","多民族文化交融的传统建筑风貌","仍在运行的古老供水系统"],"id":"lijiang-old-town","images":[],"location":{"coordSystem":"WGS-84","lat":26.8758,"lng":100.2358},"name":"丽江古城","province":"云南省","seasonNotes":"高原地区昼夜温差大，雨季集中在夏季；出行装备以当日预报为准。","source":{"name":"联合国教科文组织世界遗产中心·中国缔约国页面（丽江古城条目）","retrievedAt":"2026-10-22","url":"https://whc.unesco.org/en/statesparties/cn"},"status":"draft","suggestedDays":{"max":2,"min":1},"summary":"丽江古城依地形而建，保留了高品质的历史城镇景观，建筑融合多个民族文化元素，其古老的供水系统结构复杂且至今仍在有效运行，1997年列入世界遗产。","themes":["ancient-town","historic","photography"],"transportNotes":"可乘飞机至丽江三义机场或乘火车至丽江站，再转乘机场巴士、公交或出租车前往古城区；班次以当日运营信息为准。","type":"historic","verificationNote":"草案：坐标为古城中心近似值、图片未取得授权；完成逐项核验后才可改为 published。","verifiedAt":"2026-10-22"}]